9766110,(&nbsp;)以后，中国人民的民族意识开始普遍觉醒。,9819527,A;B;C
9765008,党的十九大的主题是：(&nbsp;)、(&nbsp;)，高举中国特色社会主义伟大旗帜，决胜全面建成小康社会，夺取新时代中国特色社会主义伟大胜利，为实现中华民族伟大复兴的中国梦不懈奋斗。,9819531,A;B;C
9767055,马克思主义认为，(&nbsp;)是世界的本原。,9819809,B
9780600,马克思主义最崇高的社会理想是(   )。<br />,9763803,\u515A\u8981\u7BA1\u515A;\u5168\u9762\u4ECE\u4E25\u6CBB\u515A
9781026,社会主义建设时期，提出知识分子是工人阶级一部分的观点的党和国家领导人是(   )。,9764202,\u5341\u4E03\u5927
9775970,大学生要继承和弘扬(   )做一个知荣辱、讲道德的人。<br />,9764317,true
9780572,我国现行宪法规定 中华人民共和国的一切权力属于(   )。<br />,9764570,\u793E\u4F1A\u4E3B\u4E49\u793E\u4F1A\u77DB\u76FE
9781038,1984年党的十二届三中全会作出了《关于经济体制改革的决定》， 提出社会主义经济是公有制基础上的有计划的(   )。,9765031,false
9782185,财产所有权的方式分为原始取得和继受取得以下(   )是原始取得。<br />,9765033,true
9781132,全面建设社会主义现代化国家的进程分两个阶段来安排。第二个阶段，从(   )，在基本实现现代化的基础上，把我国建成富强民主文明和谐美丽的社会主义现代化国家。,9765138,false
9775009,生产商品的劳动分具体劳动和抽象劳动，其中具体劳动的作用是(   )。,9765909,\u65E5\u672C
9782153,我国自古就有“君子成人之美”、“为善最乐”、“博施济众”等广为流传的格言把帮助别人视为自己应做之事看作自己的快乐。这是社会公德中的(   )。<br />,9766203,\u519C\u6C11
9775513,规定在中国通商口岸可以投资设厂的条约是(  ),9766205,\u9E26\u7247\u6218\u4E89
9780993,习近平新时代中国特色社会主义思想系统回答了(   )这个重大时代课题。,9766281,\u4F4E\u7EA7
9780589,我国宪法规定在社会主义初级阶段国家坚持(   )的分配制度。<br />,9766295,true
9775867,以爱国主义为核心的民族精神包含以下哪些精神?<br />,9766930,false
9775186,社会主义的根本任务是(   )。,9766936,false
9775517,1894年，孙中山北上京津上书( )，希望能进行自上而下的改革。,9767052,\u5B9E\u8DF5
9775195,无产阶级革命取得胜利的根本保证是(   )。,9767082,false
9819677,粤港澳大湾区总面积（）万平方公里，2017年末总人口约（）万人，2017年大湾区经济总量约10万亿元。,9767196,\u516C\u6709\u5236
9780975,党在过渡时期总路线最显著的特点是(   )。,9767987,true
9775678,革命的根本问题是  ( ) ,9768112,\u7CBE\u795E\u8D21\u732E
9775117,未来共产主义社会是(   )。,9768299,A;B;C;D
9774829,唯物主义和唯心主义在世界统一性问题上的根本分歧是(   )。,9768351,true
9775938,家庭美德是调节人们在家庭生活方面的关系和行为的道德准则。下列选项中属于家庭美德基本内容的是(   )。<br />,9768467,A
9781969,下列公民基本权利中属于监督权利的是(   )。<br />,9768473,A;B;C;D;E
9775763,毛泽东把党对军队的绝对领导权确立下来是通过 ( ) ,9774829,D
9782133,实践证明:我们人民的团结社会的稳定民主的发展国家的统一都要靠(   )。<br />,9774925,B
9780651,爱国主义是一个历史范畴当代中国的爱国主义是中华民族爱国主义发展的一个新阶段。建设和发展中国特色社会主义是新时期爱国主义的(   )。<br />,9775009,D
9819502,“四个全面”战略布局的核心是（）。,9775117,D
9774925,坚持真理的客观性就是(   )。,9775186,D
9780871,下列属于大陆法系的国家是(   )。<br />,9775195,A
9775784,1931年11月在江西省瑞金县成立的红色政权是 ( ) ,9775268,A;B;C
9775771,1933年5月，原西北军将领冯玉祥在张家口成立 ( ) ，并谋求同共产党合作。,9775291,C;D;E
9780524,法律思维是按照法的原理、法律原则和立法精神分析、解决法律问题的习惯和思想取向。下列选项中符合我国社会主义法律思维的是(   )。<br />,9775292,B;D;E
9819505,全面建成小康社会，更重要、更难做到的是（）。,9775375,A;C
9781184,(   )是中国特色社会主义的本质要求。,9775513,B
9776061,中国工人阶级政党的最早组织是在 ( ) 建立的,9775517,D
9782118,民族精神对于一个民族的重要性表现在它是(   )。<br />,9775609,D
9776116,中国共产党解决中国由新民主主义革命向社会主义革命转变的重大问题的会议是 ( ) ,9775678,C
9780618,空想和理想都是人们对未来的一种想象但空想与理想的根本区别在于:空想(   )。<br />,9775763,D
9775609,变法维新运动产生的社会条件是： ( ) ,9775771,B
9768467,2008年，我国将绝对贫困标准和低收入标准合一，统一使用（）作为国家扶贫标准。,9775784,C
9775292,教条主义(   )。,9775867,E
9775375,反映资本家对工人的剥削程度的公式是(   ),9775938,A
9819534,创新发展，包括（）。,9775970,C
9776132,参加1945年重庆谈判的中共代表有 ( ) ,9776061,A
9768473,“五位一体”全面进步的小康指在以经济建设为中心的同时，推进（）全面进步。,9776116,A
9768299,要把党的领导“最大优势”转变为最强“治理效能”，要做到（）。,9776132,B;C;D
9819771,信息数字化的优势有（）。,9780524,A
9819693,推动京津冀协同发展是重大国家战略，要在（）等重点领域率先取得突破。,9780572,B
9780710,党在过渡时期总路线的\,9780589,D
9775291,头孢曲松钠这种临床应用广泛的抗生素，如果和某些药物一起服用就会导致药效减弱、副作用增强的现象，在没有认识到这个问题时曾出现病人致死的案例，医学上称之为配伍禁忌。卫生主管部门在调查研究的基础上，没有禁止这种药物的使用，而是要求在药品使用说明书上写清配伍禁忌的有关情况说明。这一事例说明(   )。,9780600,A
9781571,建设中国特色社会主义(   )。<br />,9780618,B
9775268,阶级斗争的三种基本形式分别是(   )。,9780651,D
9781768,社会主义本质是(   )，最终实现共同富裕。,9780710,B;C;D
9781699,毛泽东规定的军事原则有(   )。,9780871,C
9781563,下列选项中属于个人理想的有:(   )。<br />,9780975,A
9764317,发展是党执政兴国的第一要务。,9780993,D
9765138,没有科学发展就没有社会和谐，没有社会和谐也可以实现科学发展。,9781026,C
9768351,疫情防控是没有硝烟的战场，也是检验初心使命的考场。,9781038,B
9766295,无产阶级的解放与全人类的解放是完全一致的。,9781132,C
9765031,宪法是国家的根本法，是党和人民意志的集中体现，因此不需要修改。,9781184,D
9765033,经过长期努力，中国特色社会主义进入了新时代，这是我国发展新的历史方位。,9781563,A;B;C
9766936,理性认识以感性认识为基础，因此，理性认识高于感性认识。,9781571,A;B;C;D
9767082,有用就是真理。,9781699,A;B;C;D
9766930,凡是亲眼所见，亲耳所听都是直接经验，是对客观事物本质的、真实反映。,9781768,A;B;C;D
9767987,理想和现实的关系是对立统一的。,9781969,C
9764570,党在八大前后，特别是毛泽东在1957年2月所作的《关于正确处理人民内部矛盾的问题》的报告，系统论述了(&nbsp;)的理论。,9782118,D
9767196,社会主义法律以(&nbsp;)为经济基础，保障全体劳动者共同占有生产资料。,9782133,A
9767052,(&nbsp;)是自然存在与社会存在区分和统一的基础。,9782153,D
9766203,封建社会，(&nbsp;)没有任何政治权利，生活极端贫困。,9782185,A
9764202,把科学发展观与马克思列宁主义、毛泽东思想、邓小平理论和“三个代表”重要思想一道写入党章是党的(&nbsp;)报告。,9819502,A
9763803,坚持(&nbsp;)、(&nbsp;)是新时代党的建设的根本方针。,9819505,B
9768112,正确评价人生价值，要坚持能力有大小与贡献须尽力相统一，坚持物质贡献与(&nbsp;)相统一，坚持完善自身与贡献社会相统一。,9819534,A;B;C;D
9766205,(&nbsp;)是中国近现代史的起点。,9819677,D
9765909,为复辟帝制，袁世凯与(&nbsp;)签订了严重损害中国利益的“二十一条”。,9819693,A;B;C
9766281,社会主义是共产主义的(&nbsp;)阶段，也是实现共产主义的必由之路。,9819771,A;B;C;D
9780600,马克思主义最崇高的社会理想是(   )。<br />,9763803,\u515A\u8981\u7BA1\u515A;\u5168\u9762\u4ECE\u4E25\u6CBB\u515A
9781026,社会主义建设时期，提出知识分子是工人阶级一部分的观点的党和国家领导人是(   )。,9764202,\u5341\u4E03\u5927
9775970,大学生要继承和弘扬(   )做一个知荣辱、讲道德的人。<br />,9764317,true
9780572,我国现行宪法规定 中华人民共和国的一切权力属于(   )。<br />,9764570,\u793E\u4F1A\u4E3B\u4E49\u793E\u4F1A\u77DB\u76FE
9781038,1984年党的十二届三中全会作出了《关于经济体制改革的决定》， 提出社会主义经济是公有制基础上的有计划的(   )。,9765031,false
9782185,财产所有权的方式分为原始取得和继受取得以下(   )是原始取得。<br />,9765033,true
9781132,全面建设社会主义现代化国家的进程分两个阶段来安排。第二个阶段，从(   )，在基本实现现代化的基础上，把我国建成富强民主文明和谐美丽的社会主义现代化国家。,9765138,false
9775009,生产商品的劳动分具体劳动和抽象劳动，其中具体劳动的作用是(   )。,9765909,\u65E5\u672C
9782153,我国自古就有“君子成人之美”、“为善最乐”、“博施济众”等广为流传的格言把帮助别人视为自己应做之事看作自己的快乐。这是社会公德中的(   )。<br />,9766203,\u519C\u6C11
9775513,规定在中国通商口岸可以投资设厂的条约是(  ),9766205,\u9E26\u7247\u6218\u4E89
9780993,习近平新时代中国特色社会主义思想系统回答了(   )这个重大时代课题。,9766281,\u4F4E\u7EA7
9780589,我国宪法规定在社会主义初级阶段国家坚持(   )的分配制度。<br />,9766295,true
9775867,以爱国主义为核心的民族精神包含以下哪些精神?<br />,9766930,false
9775186,社会主义的根本任务是(   )。,9766936,false
9775517,1894年，孙中山北上京津上书( )，希望能进行自上而下的改革。,9767052,\u5B9E\u8DF5
9775195,无产阶级革命取得胜利的根本保证是(   )。,9767082,false
9819677,粤港澳大湾区总面积（）万平方公里，2017年末总人口约（）万人，2017年大湾区经济总量约10万亿元。,9767196,\u516C\u6709\u5236
9780975,党在过渡时期总路线最显著的特点是(   )。,9767987,true
9775678,革命的根本问题是  ( ) ,9768112,\u7CBE\u795E\u8D21\u732E
9775117,未来共产主义社会是(   )。,9768299,A;B;C;D
9774829,唯物主义和唯心主义在世界统一性问题上的根本分歧是(   )。,9768351,true
9775938,家庭美德是调节人们在家庭生活方面的关系和行为的道德准则。下列选项中属于家庭美德基本内容的是(   )。<br />,9768467,A
9781969,下列公民基本权利中属于监督权利的是(   )。<br />,9768473,A;B;C;D;E
9775763,毛泽东把党对军队的绝对领导权确立下来是通过 ( ) ,9774829,D
9782133,实践证明:我们人民的团结社会的稳定民主的发展国家的统一都要靠(   )。<br />,9774925,B
9780651,爱国主义是一个历史范畴当代中国的爱国主义是中华民族爱国主义发展的一个新阶段。建设和发展中国特色社会主义是新时期爱国主义的(   )。<br />,9775009,D
9819502,“四个全面”战略布局的核心是（）。,9775117,D
9774925,坚持真理的客观性就是(   )。,9775186,D
9780871,下列属于大陆法系的国家是(   )。<br />,9775195,A
9775784,1931年11月在江西省瑞金县成立的红色政权是 ( ) ,9775268,A;B;C
9775771,1933年5月，原西北军将领冯玉祥在张家口成立 ( ) ，并谋求同共产党合作。,9775291,C;D;E
9780524,法律思维是按照法的原理、法律原则和立法精神分析、解决法律问题的习惯和思想取向。下列选项中符合我国社会主义法律思维的是(   )。<br />,9775292,B;D;E
9819505,全面建成小康社会，更重要、更难做到的是（）。,9775375,A;C
9781184,(   )是中国特色社会主义的本质要求。,9775513,B
9776061,中国工人阶级政党的最早组织是在 ( ) 建立的,9775517,D
9782118,民族精神对于一个民族的重要性表现在它是(   )。<br />,9775609,D
9776116,中国共产党解决中国由新民主主义革命向社会主义革命转变的重大问题的会议是 ( ) ,9775678,C
9780618,空想和理想都是人们对未来的一种想象但空想与理想的根本区别在于:空想(   )。<br />,9775763,D
9775609,变法维新运动产生的社会条件是： ( ) ,9775771,B
9768467,2008年，我国将绝对贫困标准和低收入标准合一，统一使用（）作为国家扶贫标准。,9775784,C
9775292,教条主义(   )。,9775867,E
9775375,反映资本家对工人的剥削程度的公式是(   ),9775938,A
9819534,创新发展，包括（）。,9775970,C
9776132,参加1945年重庆谈判的中共代表有 ( ) ,9776061,A
9768473,“五位一体”全面进步的小康指在以经济建设为中心的同时，推进（）全面进步。,9776116,A
9768299,要把党的领导“最大优势”转变为最强“治理效能”，要做到（）。,9776132,B;C;D
9819771,信息数字化的优势有（）。,9780524,A
9819693,推动京津冀协同发展是重大国家战略，要在（）等重点领域率先取得突破。,9780572,B
9780710,党在过渡时期总路线的\,9780589,D
9775291,头孢曲松钠这种临床应用广泛的抗生素，如果和某些药物一起服用就会导致药效减弱、副作用增强的现象，在没有认识到这个问题时曾出现病人致死的案例，医学上称之为配伍禁忌。卫生主管部门在调查研究的基础上，没有禁止这种药物的使用，而是要求在药品使用说明书上写清配伍禁忌的有关情况说明。这一事例说明(   )。,9780600,A
9781571,建设中国特色社会主义(   )。<br />,9780618,B
9775268,阶级斗争的三种基本形式分别是(   )。,9780651,D
9781768,社会主义本质是(   )，最终实现共同富裕。,9780710,B;C;D
9781699,毛泽东规定的军事原则有(   )。,9780871,C
9781563,下列选项中属于个人理想的有:(   )。<br />,9780975,A
9764317,发展是党执政兴国的第一要务。,9780993,D
9765138,没有科学发展就没有社会和谐，没有社会和谐也可以实现科学发展。,9781026,C
9768351,疫情防控是没有硝烟的战场，也是检验初心使命的考场。,9781038,B
9766295,无产阶级的解放与全人类的解放是完全一致的。,9781132,C
9765031,宪法是国家的根本法，是党和人民意志的集中体现，因此不需要修改。,9781184,D
9765033,经过长期努力，中国特色社会主义进入了新时代，这是我国发展新的历史方位。,9781563,A;B;C
9766936,理性认识以感性认识为基础，因此，理性认识高于感性认识。,9781571,A;B;C;D
9767082,有用就是真理。,9781699,A;B;C;D
9766930,凡是亲眼所见，亲耳所听都是直接经验，是对客观事物本质的、真实反映。,9781768,A;B;C;D
9767987,理想和现实的关系是对立统一的。,9781969,C
9764570,党在八大前后，特别是毛泽东在1957年2月所作的《关于正确处理人民内部矛盾的问题》的报告，系统论述了(&nbsp;)的理论。,9782118,D
9767196,社会主义法律以(&nbsp;)为经济基础，保障全体劳动者共同占有生产资料。,9782133,A
9767052,(&nbsp;)是自然存在与社会存在区分和统一的基础。,9782153,D
9766203,封建社会，(&nbsp;)没有任何政治权利，生活极端贫困。,9782185,A
9764202,把科学发展观与马克思列宁主义、毛泽东思想、邓小平理论和“三个代表”重要思想一道写入党章是党的(&nbsp;)报告。,9819502,A
9763803,坚持(&nbsp;)、(&nbsp;)是新时代党的建设的根本方针。,9819505,B
9768112,正确评价人生价值，要坚持能力有大小与贡献须尽力相统一，坚持物质贡献与(&nbsp;)相统一，坚持完善自身与贡献社会相统一。,9819534,A;B;C;D
9766205,(&nbsp;)是中国近现代史的起点。,9819677,D
9765909,为复辟帝制，袁世凯与(&nbsp;)签订了严重损害中国利益的“二十一条”。,9819693,A;B;C
9766281,社会主义是共产主义的(&nbsp;)阶段，也是实现共产主义的必由之路。,9819771,A;B;C;D
9781512,虚无论在对待传统道德上否定(   )实际上割裂了道德的历史继承性。<br />,9763578,\u4E2D\u534E\u6C11\u65CF\u4F1F\u5927\u590D\u5174
9781461,人生价值评价应坚持(   )。<br />,9763672,false
9781486,人类道德进步的主要表现(   )。<br />,9764397,\u8BB2\u653F\u6CBB;\u8BB2\u6B63\u6C14
9768341,（）、（）始终是本次战“疫”的主战场。,9764584,false
9780743,下列属于对中共一大内容的描述不正确的有 ( ) ,9764932,true
9819729,习近平总书记强调，对外工作要坚持战略自信和保持战略定力，要贯彻落实总体国家安全观，增强全国人民对中国特色社会主义的（），维护国家长治久安。,9765010,\u548C\u5E73\u5171\u5904\u4E94\u9879\u539F\u5219
9780790,中国七届二中全会决议指出：全国胜利并解决了土地问题以后，中国还存在的两种基本的矛盾是 ( ) ,9765254,\u653F\u793E\u5408\u4E00
9768468,习近平总书记在中央扶贫开发工作会议上提出要实施“五个一批”工程，即发展生产脱贫一批、（）、（）、（）、社会保障兜底一批。,9765915,false
9775268,阶级斗争的三种基本形式分别是(   )。,9766003,\u300A\u8D44\u653F\u65B0\u7BC7\u300B
9775286,人类当今面临的环境问题的表现有(   )。,9766118,\u519B\u4E8B\u4FB5\u7565
9781732,二十世纪五十年代中期，社会主义改造基本完成，标志着(   ),9766408,\u89E3\u653E\u601D\u60F3;\u5B9E\u4E8B\u6C42\u662F
9768403,（）是伟大的中华民族精神在当代历史中的新表现。,9766425,true
9781829,坚持总体国家安全观要(   )。,9766773,\u793E\u4F1A\u610F\u8BC6
9781762,社会主义建设时期，关于经济体制和运行机制改革，毛泽东提出了“两参一改三结合”的思想，其主要内容是(   )。,9766791,true
9775265,社会改革的社会作用主要表现(   )。,9766913,true
9763672,“一带一路”中的“一路”是指“丝绸之路经济带”。,9767219,\u6CD5\u5F8B\u4E49\u52A1
9766425,认识是一个不断反复和无限发展的过程。,9767638,false
9766791,人是一切社会关系的承担者。,9767667,true
9765915,1915年底，袁世凯改中华民国为“中华帝国”，年号宣统。,9767798,false
9767638,资产阶级提出的“民主、自由、博爱”同社会主义核心价值观一样具有道义性、真实性。,9767949,\u5BF9\u7ACB\u7EDF\u4E00
9764584,在全面建设社会主义时期，党对社会主义建设道路的探索是完全成功的。,9768341,A;B
9764932,马克思主义同中国革命实际相结合的过程，同时也是毛泽东思想形成和发展的过程。,9768403,A;B;D
9767667,大学生培育和践行核心价值观要做到勤学修德明辨笃实。,9768468,A;B;C
9766913,认识是否具有真理性，既不能从认识本身得到证实，也不能从认识对象中得到回答，只有在实践中才能得到验证。,9774859,A
9767798,爱国主义与爱社会主义是可以割裂开的。　,9774991,A
9766408,1978年12月，党的十一届三中全会重新确立了(&nbsp;)、(&nbsp;)的思想路线，彻底否定了“以阶级斗争为纲”的错误理论和实践。,9774997,A
9766118,资本-帝国主义列强对中国的侵略，首先和主要的是进行(&nbsp;)。,9774998,B
9766003,(&nbsp;)是中国近代历史上第一个比较系统的发展资本主义的方案。,9775027,D
9765010,党的十九大强调，在外交工作上，坚持和平发展道路，坚定不移在(&nbsp;)基础上发展同各国的友好合作。,9775095,A
9764397,领导干部一定要讲学习、(&nbsp;)、(&nbsp;)。,9775107,C
9767219,(&nbsp;)是指反映一定的社会物质生活条件所制约的社会责任，是保障法律所规定的义务人应该按照权利人要求从事一定行为或不行为以满足权利人利益的法律手段。,9775154,D
9763578,实现(&nbsp;)是近代以来中华民族最伟大的梦想。,9775179,A
9766773,(&nbsp;)是社会生活的精神方面，是社会存在的反映。,9775211,D
9765254,1958年，人民公社实行的体制是(&nbsp;)。,9775221,C
9767949,我们要辩证的看待理想与现实的矛盾，理想与现实是(&nbsp;)的。,9775265,A;B;C;D
9819710,习近平总书记在党的十九大报告中指出，中国将“始终做世界和平的（）、全球发展的（）、国际秩序的（）”。,9775268,A;B;C
9775877,职业理想是指<br />,9775286,A;B;C;D
9775782,中国共产党早期组织领导的第一个工会是 ( ) ,9775604,A
9781183,坚持开放发展，就要奉行(   )的开放战略。,9775646,B
9775992,个人品德的形成过程包含多种心理成分的相应发展。其中人们遵循道德原则规范所表现出的外在活动称为(   )。<br />,9775654,C
9781626,人们在处理个人与他人个人与社会关系的一系列行为中表现出来的比较稳定的道德倾向和特征称为<br />,9775752,D
9819669,以（）为内涵的新发展理念，是我国经济由高速增长阶段转向高质量发展阶段的重要指导理念。,9775782,B
9776006,(   )是指一种诚实不欺、遵守诺言的品格。<br />,9775832,B
9781343,推动建立新型国际关系，要积极参与(   )改革和建设。,9775877,D
9781602,中华名族最深沉的民族凛赋是<br />,9775920,F
9775107,“必然王国”和“自由王国”是(   )。,9775992,A
9819520,从全面建成小康社会到基本实现现代化，再到全面建成（  ），是新时代中国特色社会主义发展的战略安排。,9776006,B
9780572,我国现行宪法规定 中华人民共和国的一切权力属于(   )。<br />,9776076,D
9774998,在马克思主义的组成部分中，(   )是马克思主义理论最深刻、最全面、最详细的证明和运用。,9780572,B
9774991,19世纪40—60年代，马克思的两大发现是(   )。,9780743,A;B
9775654,鸦片战争后，中国经济逐渐被卷入世界资本主义市场，其对中国的影响不包括  ( ) ,9780790,B;C
9780943,帝国主义奴役近代中国的社会基础是(   )。,9780931,C
9781666,以下对法律的含义理解正确的是<br />,9780943,A
9774859,对于事物的联系，唯心主义者的主要错误在于否认(   )。,9781183,D
9775095,历史表明，(   )是决定国家政权属于什么性质的首要标志。,9781343,C
9775752,标志和谈之门被国民党全部关闭、国共关系彻底破裂的是  ( ) ,9781461,A;B;C;D
9775221,没有抽象的真理，真理总是具体的。这一命题强调(   )。,9781486,A;B;C;D
9781883,(   )是人类道德起源的第一个历史前提。<br />,9781512,B;C
9775604,帝国主义列强对中国进行文化渗透的主要目的是 ( ) ,9781581,D
9782102,爱国主义是一个历史范畴当代中国的爱国主义是中华民族爱国主义发展的一个新阶段。建设和发展中国特色社会主义是新时期爱国主义的(   )。<br />,9781602,B
9775646,1920年，俄共派 ( ) 来华，这对中共的创建起了促进作用,9781626,C
9775832,19世纪末，维新变法从一种思潮得以发展成为一场政治运动，关键是： ( ) ,9781632,B
9775211,“蒸汽、电力和自动纺织机甚至是比巴尔贝斯、拉斯拜尔和布朗基诸位公民更危险万分的革命家。”这一论断的含义是(   )。,9781666,A
9780931,“因为中国资产阶级根本上与剥削农民的豪绅地主相混合，中国革命要推翻地主阶级，便不能不同时推翻资产阶级”。这一观点的主要错误是(   )。,9781732,A;B;D
9775154,“坐地日行八万里，巡天遥看一千河”，这一著名诗句包含的哲理是(   )。,9781762,A;B;C;D
9774997,在马克思主义的组成部分中，构成整个马克思主义的基础部分的是(   )。,9781829,A;B;C;D
9782123,极力倡导“横眉冷对千夫指俯首甘为孺子牛”的是(   )。<br />,9781883,A
9819889,这次武汉地区发生的肺炎是一种由新型冠状病毒引起严重的（）症候群。,9782102,D
9776076,百团大战的指挥者是 ( ) ,9782123,A
9775179,无产阶级专政的实质，就是(   )。,9819520,B
9775027,在资本主义制度下，资本家与劳动者之间的关系是(   )。,9819669,C
9775920,公民应履行的基本法律义务<br />,9819676,B
9781581,理想的超越性表现为<br />,9819710,A
9819676,2019年9月，《长江经济带发展规划纲要》正式印发，从各方面描绘了长江经济带发展的宏伟蓝图，确立了长江经济带（）的发展新格局。,9819729,A;B;C;D
9781632,以下各项不属于道德模范是<br />,9819889,A
9819707,“百年未有之大变局”的核心在于（）。,9763648,\u5171\u540C\u53D1\u5C55
9774805,划分唯物史观和唯心史观的根据是(   )。,9763673,true
