9781561,现阶段我国公有制经济包括:(   )。<br />,9780557,A
9780793,帝国主义直接控制了中国的两项税收： ( ) ,9780587,C
9768347,面对来势凶猛的疫情，将制度优势并转化为治理效能，坚持全国一盘棋，切实做到( )。,9780633,D
9781440,在哪些生活领域都要遵守相应的道德和法律(   )。<br />,9780704,A;C
9819850,可以预防新型冠状病毒方法有哪些？（ ）,9780730,B;C;D
9781520,社会主义社会强调集体利益高于个人利益表现为(   )。<br />,9780769,A;B;C;D
9780781,下列关于“八七”会议的表述正确的是 ( ) ,9780781,A;B;C;D
9781695,中国革命曾走过很大弯路、遭受严重挫折的重要原因有(   )。,9780793,A;D
9781813,以下属于社会主义核心价值观内容的有(   )。,9780839,B
9775243,马克思主义是(   )。,9780859,B
9780730,1922年7月中共二大明确提出了反帝反封建的民主革命纲领，这个纲领的基本点包括 ( ) ,9781052,C
9780769,在抗日战争的战略防御阶段，国民党军队在正面战场组织的重大战役有 ( ) ,9781182,C
9819788,媒体使用的终端介质包括（）。,9781198,D
9780704,中国资产阶级的双重性格是 ( ) ,9781252,A
9819731,新时代是奋斗者的时代。新时代属于每一个人，每一个人都是新时代的（）、（）、（）。,9781328,A
9766421,早在19世纪末20世纪初，马克思学说便已被介绍到中国，但这种介绍是零星的、片面的和不成熟的，存在着不少误解和歪曲。,9781342,B
9768622,经济全球化就是国际贸易的自由化。,9781343,C
9763926,民生是人民幸福之基，社会和谐之本。,9781440,A;B;D
9767982,中国特色社会主义共同理想，就是在中国共产党领导下，坚持和发展中国特色社会主义，实现中华民族伟大复兴。,9781520,A;C;D
9766799,每一次社会制度的变革，无不经过曲折反复的斗争。,9781561,A;B
9768363,战胜新冠肺炎疫情，团结协作是最有力的武器。,9781695,A;B;C;D
9767661,只有虚化若谷，才能博彩众长，掌握更丰富的知识。,9781813,A;B;C;D
9767426,大学生讲正气不等同于讲义气。,9781909,D
9764591,社会主义改造基本完成后，人民内部矛盾逐步成为我国政治生活中居于主导地位的矛盾。,9781910,A
9768162,一般说来，随着社会的进步，人生价值实现的社会客观条件也在不断改善。,9781922,B
9766775,(&nbsp;)是社会意识的重要组成部分是一个国家、一个民族的灵魂。,9782111,A
9765857,(&nbsp;)开辟了世界反法西斯战争的东方主战场。,9782146,B
9767377,在道德的功能系统中，认识功能、规范功能、调节功能是最基本的功能，此外还有(&nbsp;)、(&nbsp;)等。,9819575,A
9765591,中国抗战以来的第一次大捷是(&nbsp;)。,9819707,A
9765255,1958年，人民公社的基本特点被概括为“(&nbsp;)”。,9819731,A;B;C
9768111,人生当(&nbsp;)，要从人生的实际出发，以科学的态度看待人生，以务实的精神创造人生。,9819788,A;B;C;D
9764907,历史反复证明，(&nbsp;)是历史发展和社会进步的主体力量。,9819837,B
9764775,国营经济是通过没收(&nbsp;)建立起来的。,9819850,A;B;C;D
9767622,对于大学生而言，就是要切实做到(&nbsp;)、(&nbsp;)、(&nbsp;)、(&nbsp;)，使社会主义核心价值观成为一言一行的基本遵循。,9819885,A
9765011,实现中国梦必须走(&nbsp;)，弘扬(&nbsp;)，凝聚(&nbsp;)。,9819903,D
9765019,(&nbsp;)是国家的根本法，是治国安邦的总章程。,9763574,\u5DE5\u4EBA\u9636\u7EA7
9767197,我国社会主义法律既具有鲜明的阶级性，又具有广泛的人民性，体现了(&nbsp;)与人民性的统一。,9763936,false
9763574,中国共产党是中国(&nbsp;)的先锋队。,9764801,true
9765486,革命的根本问题是国家(&nbsp;)问题。,9765019,\u5BAA\u6CD5
9765490,1947年6月底，根据中共中央的决策和部署，(&nbsp;)和(&nbsp;)率领的晋冀鲁豫野战军主力，实施中央突破，千里跃进大别山,9765452,\u6BDB\u6CFD\u4E1C\u601D\u60F3
9767206,刑事处罚包括(&nbsp;)和(&nbsp;)两部分,9765486,\u653F\u6743
9767952,理想的实现是一个过程实现理想的过程具有长期性、(&nbsp;)和(&nbsp;)。,9765490,\u5218\u4F2F\u627F;\u9093\u5C0F\u5E73
9765452,以毛泽东为主要代表的中国共产党人，把马克思列宁主义的基本原理同中国实际相结合，创立了(&nbsp;)。,9765615,true
9766001,(&nbsp;)和(&nbsp;)的论战是近代中国资产阶级思想与封建主义思想的第一次正面交锋。,9766001,\u7EF4\u65B0\u6D3E;\u5B88\u65E7\u6D3E
9767369,集体主义强调国家利益、社会整体利益和(&nbsp;)的辩证统一。,9766790,true
9780972,在我国，剥削阶级和剥削制度被消灭的标志是(   )。,9767085,true
9775100,社会主义改革是(   )发展的内在要求。,9767197,\u9636\u7EA7\u6027
9781648,法构成要素的主要部分是<br />,9767206,\u4E3B\u5211;\u9644\u52A0\u5211
9781270,(   )关系党和人民事业前途命运，关系党的执政基础和执政地位。,9767369,\u4E2A\u4EBA\u5229\u76CA
9775948,有权行使限制人身自由的行政处罚权的机关是(   )。<br />,9767788,true
9819827,如微信群内看到“未经证实”关于身边某某地又发现新的新型冠状病毒肺炎疫情情况的文字和图片信息，应该如何应对（）。,9767806,true
9775147,马克思主义最崇高的社会理想(   )。,9767952,\u8270\u5DE8\u6027;\u66F2\u6298\u6027
9781340,当前全球政治经济版图正在发生改变的一个重要标志是新兴市场国家和(   )集体性崛起。,9767978,false
9781175,新发展理念是是习近平新时代中国特色社会主义(   )思想的主要内容。,9768436,B
9774969,生产关系是指(   )。,9768543,A;B;C
9775022,商品生产者要获得更多收益必须使生产商品的(   )。,9768584,A
9780562,全国人民代表大会是由(   )。<br />,9768663,true
9775645,率领北平国民党军队接受和平改编的国民党将领是 ( ) ,9774839,D
9775162,唯物辩证法的否定之否定规律揭示了事物发展的(   )。,9774885,A
9775163,主观辩证法与客观辩证法的关系是(   )。,9774886,C
9774885,只承认量变，不承认质变就会导致(   )。,9774969,A
9781253,(   )是人与自然相处时应遵循的基本原则。,9775022,D
9775157,辩证唯物主义认为事物发展的规律是(   )。,9775100,D
9781985,根据我国宪法的规定狭义的人身自由主要指(   )。<br />,9775147,A
9781619,(  )是近代以来中华民族最伟大的梦想。<br />,9775157,C
9819707,“百年未有之大变局”的核心在于（）。,9775162,A
9768436,（）是社会主义核心价值观的最大公约数。,9775163,A
9775840,理想作为一种社会意识形态不是从天而降的而是<br />,9775238,A;B;D
9774839,总的量变过程中的阶段性部分质变是指(   )。,9775299,B;D
9780863,思想道德素质和(     )是人的基本素质。<br />,9775319,A;C
9780921,毛泽东指出(   )是党的生命。,9775405,A;B;C;D;E
9781245,(   )是人与自然相处时应秉持的首要态度。,9775552,C
9781226,带领人民群众创造幸福生活，就要坚持以人民为中心的发展思想，以保障和改善(   )为重点，发展各项社会事业。,9775645,B
9782094,禁止民事权利滥用原则要求民事主体在从事民事活动、行使民事权利时不得(   )。<br />,9775825,C
9780807,在新的历史条件下形成和发展的体现民族特质、顺应时代潮流的思想观念、行为方式、价值取向、精神风貌和社会风尚的总和指的是(   )。<br />,9775840,A
9774886,质变的复杂性表现为(   )。,9775852,C
9780985,下面关于社会主义改造不正确的论述是(   )。,9775948,A
9775852,爱国主义所反映的个人与祖国的关系是<br />,9775995,D
9768584,国之交在于民相亲，民相亲在于（）。,9776129,B;C;D
9775825,\,9776179,A;C;D
9775995,在我国社会主义初级阶级社会主义集体主义道德原则具有多层次的道德要求。其中最基本的道德要求是(   )。<br />,9780562,D
9781298,新时代党的好干部标准是(   )。,9780767,B;D
9775552,1947年被国民党宣布为\,9780807,D
9780917,毛泽东规定了(   )是人民军队的唯一宗旨。,9780863,D
9781050,社会主义的根本任务是(   )。,9780917,B
9781399,良好的思想道德素质和法治素养是在(  )的结果<br />,9780921,C
9776129,中国早期接受宣传马克思主义的主要是 ( ) ,9780972,C
9775319,哲学和世界观的区别是(   )。,9780985,D
9781798,江泽民强调，我们想事情，做工作，想得对不对，做得好不好，根本的衡量尺度，就是(   ),9781050,C
9775405,垄断与竞争并存的原因是(   )。,9781175,A
9781543,下列关于法的本质和特征的表述中正确的有:(   )。<br />,9781226,B
9781491,继承和弘扬中华民族优良道德的重大意义是(   )。<br />,9781245,A
9781761,社会主义建设时期，陈云提出了“三个主体、三个补充”的设想。该设想的主要内容有(   )。,9781253,B
9768543,推动建设（）的新型国际关系，是党中央立足时代发展潮流和我国根本利益作出的战略选择，反映了中国人民和世界人民的共同心愿。,9781270,B
9780767,那拉氏掌控清朝最高统治近半个世纪，当时在位清帝是 ( ) ,9781298,A
9819743,习近平总书记指出，坚持总体国家安全观，走中国特色国家安全道路。下面关于走中国特色国家安全道路的原则，表述正确的是（）。,9781340,D
9781708,近代中国革命的主要敌人有(   ),9781399,A;B;C;D
9775299,割裂事物发展过程中的前进性和曲折性会导致(   )。,9781491,B;C;D
9775238,马克思主义中国化的三大理论成果是(   )。,9781543,A;B;D
9776179,《新青年》的主要撰稿人有 ( ) ,9781619,C
9767085,实践之所以是检验真理的唯一标准是由真理的本性和实践的特点决定的。,9781648,A
9766790,合理地利用自然资源，保护生态平衡，是社会得以正常发展的必要条件。,9781708,A;B;C
9767806,经济全球化不等于全球政治、文化一体化。,9781761,A;B;C
9763936,“一国两制”中，“两制”是实行“一国”的前提和基础，“一国”从属和派生于“两制”，并统一于“两制”之内。,9781798,A;B;C;D
9764801,新民主主义革命的道路，是一条农村包围城市，武装夺取政权的革命道路。,9781985,A
9767788,民族精神和时代精神是中国精神的主要内容。,9782094,B
9767978,理想是人们在想象的基础上对社会历史发展规律的正确把握。,9819656,false
9819656,根据宪法规定，我国经济制度的分配方式实行以按劳分配为主体、按需分配为辅的分配制度。,9819707,A
9768663,实现两个翻番和打好三大攻坚战，是2020年必须完成好的硬任务。,9819743,A;B;C;D;E
9765615,抗日战争是近代以来中国人民第一次取得完全胜利的民族解放战争。,9819827,B
9780971,我国建国初期政权的性质是(   )。,9763730,\u5357\u660C\u8D77\u4E49
9781013,根据《关于正确处理人民内部矛盾的问题》的分析，对于政治思想领域的人民内部矛盾，解决的具体方针是(   )。,9764310,false
9819526,“四个全面”是指（）、全面深化改革、全面依法治国、全面从严治党。,9764564,\u300A\u8BBA\u5341\u5927\u5173\u7CFB\u300B
9768438,“小康”一词最早出自（）。,9764571,\u654C\u6211\u77DB\u76FE;\u4EBA\u6C11\u5185\u90E8\u77DB\u76FE
9775056,在垄断资本主义的各个基本经济特征中最根本的特征是(   )。,9764907,\u4EBA\u6C11\u7FA4\u4F17
9775676,1938年3月，国民党军队在正面战场上取得大捷、歼灭日军1万余人的战役是 ( ) ,9765152,\u5357\u65B9\u8C08\u8BDD
9780531,法律部门有实体法与程序法之分。下列属于程序法的是(   )。<br />,9765362,\u300A\u4E2D\u534E\u4EBA\u6C11\u5171\u548C\u56FD\u5BAA\u6CD5\u300B
9774893,假象同真象一样具有客观性，这是(   )。,9765369,true
9819562,在精准扶贫的主要内容中，精准衡量脱贫成效，解决的是（）的问题。,9765909,\u65E5\u672C
9781196,建设现代化经济体系，必须建设统一开放、竞争有序的(   )。,9766233,true
9780921,毛泽东指出(   )是党的生命。,9766278,\u5171\u4EA7\u4E3B\u4E49
9775610,革命派与改良派论战的焦点是 ( ) ,9766302,true
9782123,极力倡导“横眉冷对千夫指俯首甘为孺子牛”的是(   )。<br />,9766539,true
9781000,毛泽东的(   )，初步总结了我国社会主义建设的经验，明确提出了以苏为鉴，独立自主地探索适合中国情况的社会主义建设道路。,9766639,\u5974\u96B6\u793E\u4F1A
9775146,马克思主义最重要的理论品质是(   )。,9766647,true
9775912,(  )是指有立法权的国家机关依照法定职权和程序、制定规范性法律文件的活动是法律运行的起始性和关键性环节,9766770,\u52B3\u52A8\u8D44\u6599;\u52B3\u52A8\u5BF9\u8C61;\u52B3\u52A8\u8005
9781188,只有推进供给侧结构性改革，提髙(   )体系质量，才能推动经济高质量发展。,9767458,false
9775874,“两个一百年”奋斗目标是指<br />,9767650,true
9775967,人在社会生活中所处的具体环境称为(   )。<br />,9768438,D
9781106,与(  )相联系是进行道德修养的根本途径(   )。<br />,9768466,D
9774960,历史唯物主义和历史唯心的根本区别在于(   )。,9774893,B
9782065,孙中山曾激励广大青年:“要立志做大事不要立志做大官。”就是希望青年人要(   )。<br />,9774960,A
9782008,我国现行宪法是在(   )年颁布的。<br />,9775056,C
9782160,下列选项中不属于行政处罚措施的是(   )。<br />,9775119,A
9775555,中国共产党明确提出彻底的反帝反封建的纲领是在 ( ) ,9775146,D
9781911,通过反复检查以发现和找出自己思想中的不良念头和行为上的不良习惯并将坚决克服和整治掉。这是完善个人品质中(   )。<br />,9775335,A;B;D
9781643,我国大部分法律法规都是由(  )机关执行的<br />,9775349,A;C
9775751,起了临时宪法作用并以此为中华人民共和国中央人民政府施政方针的文献是 ( ) ,9775350,B;C;D
9775518,左翼文化运动中最伟大和最英勇的旗手是( ),9775518,C
9819839,2019年12月，新型冠状病毒肺炎首先出现在我国的哪个省份（ ）。,9775555,D
9782040,希望选择一种理想的职业找到一个理想的工作;希望自己在工作和职业活动中达到理想的境界取得理想的成绩。这是(   )。<br />,9775610,D
9781012,毛泽东指出，解决人民内部矛盾的总方针是(   )。,9775649,B
9776054,中国共产党 ( ) 将毛泽东思想规定为中国共产党的一切工作的指针。,9775676,A
9781217,(   )是两岸关系的政治基础。,9775751,B
9781003,中国共产党关于社会主义建设道路的探索是(   )开始的。,9775874,D
9776082,1935年12月 中国共产党确定抗日民族统一战线政策的会议是 ( ) ,9775912,A
9775649,抗战初期，国民党内部存在的\,9775967,C
9768466,1986年，我国第一次制定国家扶贫标准，当年为农民人均年纯收入（）。,9776054,B
9775119,当前，为实现共产主义理想而奋斗，集中体现在(   )。,9776082,B
9782113,“先天下之忧而忧后天下之乐而乐”体现了一种(   )。<br />,9780531,C
9775349,一切以时间、地点和条件为转移这是(   )。,9780732,A;D
9781793,发展社会主义先进文化，就是发展面向现代化、面向世界、面向未来的，民族的科学的大众的社会主义文化。江泽民指出，加强文化建设，必须要:(   ),9780921,C
9781835,下列属于民族振兴内涵的是(   )。,9780971,D
9819583,精准扶贫的主要内容包括（）。,9781000,D
9819536,坚持人与自然和谐共生，坚定走（  ）的文明发展道路，建设美丽中国，为人民创造良好生产生活环境，为全球生态安全作出贡献。,9781003,B
9775350,唯物主义一元论主张(   )。,9781012,A
9781742,在《论十大关系》中，关于消极因素和积极因素的说法正确的是(   ),9781013,A
9781529,大学生应在几个重要的环节上加强公民道德建设的实践(   )。<br />,9781106,C
9775335,割裂必然性与偶然性辩证关系的机械决定论(   )。,9781188,B
9819776,目前我国主流媒体融合发展方式有（）。,9781196,B
9781507,在对待传统道德的问题上要反对两种错误的思潮(   )。<br />,9781217,C
9781491,继承和弘扬中华民族优良道德的重大意义是(   )。<br />,9781491,B;C;D
9780732,抗日战争胜利之后，中国国内形势的重大变化有 ( ) ,9781507,B;C
9819634,中国共产党与各民主党派合作的基本方针是（）。,9781529,A;B;C
9781732,二十世纪五十年代中期，社会主义改造基本完成，标志着(   ),9781643,A
9766539,资本主义国家也有国企之说。,9781732,A;B;D
9767458,在社会主义条件下，做到大公无私似乎是不可能的。,9781742,A;B;C
9819928,中华民族历史上经历过很多磨难，但从来没有被压垮过，而是愈挫愈勇，不断在磨难中成长、从磨难中奋起。,9781793,A;B;C;D
9765369,党在过渡时期的总路线是“一化三改”。,9781835,A;B;C;D
9766302,在共产主义社会，战争也将不复存在。,9781911,B
9767650,社会主义核心价值观是社会主义核心价值体系的内核，体现着社会主义核心价值体系的根本性质和基本特征。,9782008,C
9766647,资本集中是指个别资本通过结合而形成较大的资本。,9782040,B
9764310,提出“三个代表”重要思想的领导人是邓小平。,9782065,D
9819702,区域经济是国民经济体系的重要组成部分。,9782113,C
9766233,鸦片战争是中国近代史的起点。,9782123,A
9764571,毛泽东强调：在我们面前有两类社会矛盾，这就是(&nbsp;)和(&nbsp;)，这是两类性质完全不同的矛盾,9782160,D
9764907,历史反复证明，(&nbsp;)是历史发展和社会进步的主体力量。,9819526,A
9765909,为复辟帝制，袁世凯与(&nbsp;)签订了严重损害中国利益的“二十一条”。,9819536,A;B;C
9766770,生产力的基本要素包括(&nbsp;)、(&nbsp;)和(&nbsp;)。,9819562,D
9763730,党对军队绝对领导的根本原则和制度，发端于(&nbsp;)，奠基于三湾改编，定型于古田会议，是人民军队完全区别于一切旧军队的政治特质和根本优势。,9819583,A;B;C;D
9765362,1954年，第一届全国人民代表大会第一次会议通过了(&nbsp;)。,9819634,A;B;C;D
9765152,1992年，邓小平发表(&nbsp;)，对整个社会主义现代化建设事业产生了重大而深远的影响。,9819702,true
9766639,(&nbsp;)是人类历史上第一个阶级剥削社会。,9819776,A;B;C;D
9766278,(&nbsp;)理想一定会实现，是以人类社会发展规律以及资本主义社会的基本矛盾发展为依据的。,9819839,C
9764564,标志着党探索中国社会主义建设道路的良好开端的是(&nbsp;)的发表。,9819928,true
9780994,实现社会主义现代化、创造人民美好生活的必经之路是(   )。,9763728,\u653F\u6CBB\u5EFA\u519B
9781986,关于法的产生下列说法错误的是(   )。<br />,9764131,true
9775675,辛亥革命与戊戌变法的不同之处是，辛亥革命 ( ) ,9764201,\u5168\u9762\u534F\u8C03\u53EF\u6301\u7EED
9775867,以爱国主义为核心的民族精神包含以下哪些精神?<br />,9764394,\u53D1\u5C55
9780922,毛泽东提倡，知识分子要同(   )相结合。,9764430,true
9775982,墨家提倡“察色修身”“以身戴行” 反映的是中华民族(   )优良道德传统。<br />,9764569,\u4EBA\u6C11\u5185\u90E8\u77DB\u76FE
9781191,深化供给侧结构性改革，必须持续推进(   )，优化市场供求结构。,9764807,false
9775918,下面哪个关于法律的说法是正确的<br />,9765019,\u5BAA\u6CD5
9781339,文化已成为国家核心竞争力的重要组合部分，越来越多的国家把提高(   )作为重要发展战略。,9765021,true
9819677,粤港澳大湾区总面积（）万平方公里，2017年末总人口约（）万人，2017年大湾区经济总量约10万亿元。,9765767,\u4E2D\u56FD\u5171\u4EA7\u515A
9782163,每个社会成员都应该爱护公共财物如对公园里的花木草地、街道两旁的电话邮筒、影剧院里的座位音响、马路上的井盖路标等加以保护不损坏、不滥用、不浪费、不私占。这是属于(   )。<br />,9766410,true
9775573,1941年5月，毛泽东做了 ( ) 的报告，整风运动首先在党的高级干部中进行。,9766522,true
9781920,“先天下之忧而忧后天下之乐而乐 ” 反映的是中华民族(   )优良道德传统。<br />,9766630,\u300A\u8D44\u672C\u8BBA\u300B
9781249,在生态系统保护和修复中，把(   )修复生态系放在首位。,9766900,\u5BA2\u89C2\u6027;\u591A\u7EF4\u6027
9782044,中国特色社会主义共同理想与共产主义远大理想有着内在的联系它们之间是(   )。<br />,9767366,\u9053\u5FB7\u8BC4\u4EF7
9774839,总的量变过程中的阶段性部分质变是指(   )。,9767386,\u4E2A\u4EBA\u54C1\u5FB7
9781875,大学生要继承和弘扬(   )做一个知荣辱、讲道德的人。<br />,9767411,false
9819566,习近平总书记多次指出，小康不小康，关键看（）。,9767637,false
9781035,“文革”结束后，党的(   )重新确立解放思想、实事求是的思想路线。,9768292,A
9776064,资产阶级革命派形成的标志是 ( ) ,9768367,B;C;D
9775055,在垄断资本主义阶段占统治地位的资本是(   )。,9768386,A
9781072,江泽民对全面建设小康社会、实现第三步战略目标进行了前瞻性的战略思考。他在党的(   )报告中初步勾画了实现第三步战略目标的蓝图:,9768421,false
9781181,(   )是永续发展的必要条件。,9774830,A
9781326,必须做好(   )这篇大文章，充分发挥其对国防建设和经济社会发展的双向支撑拉动作用，实现经济建设和国防建设综合效益最大化。,9774839,D
9768292,构建良好的分配秩序，形成正确的激励导向，有助于全社会弘扬勤劳致富、艰苦奋斗精神，主动通过（）去创造美好生活。,9774840,B
9775964,视金钱为圣物以追逐和获取金钱为人生的目的和生命的全部意义的是(   )人生观。<br />,9774875,C
9775809,镇压了太平天国起义，位列所谓湘军四大将帅和同治中兴四大名臣之首 ( ) ,9775055,D
9781932,在社会主义道德体系中(   )是指导人们行为选择的主导性原则。<br />,9775142,A
9819834,目前确诊的新型冠状病毒肺炎的患者年龄集中在（ ）岁。,9775284,A;B;C
9774840,否认事物的发展是前进性和曲折性的统一，会导致两种错误，一种是直线论，另一种是(   )。,9775299,B;D
9780627,理想是人们的世界观、人生观、价值观在奋斗目标上的(   )。<br />,9775358,A;B
9774875,事物矛盾问题的精髓是(   )。,9775411,B;C;D
9774830,“动中有静、静中有动”，说的是(   )。,9775504,C
9775504,全行业公私合营阶段，对企业利润的分配实行(  ),9775573,A
9780928,毛泽东思想包含毛泽东一生中(   )。,9775675,D
9782131,增强国防观念是保障国家安全的需要是增强民族凝聚力和向心力的“黏合剂”因而也是新时期(   )。<br />,9775809,D
9768386,《宪法》规定：（）是中华人民共和国的根本制度。,9775867,E
9781906,社会主义道德是(   )伦理思想同中国特色社会主义伟大实践相结合的产物是对中国古代优良道德传统的传承与升华是中国革命道德传统的直接继承和发展。<br />,9775918,C
9775142,“哲学把无产阶级当作自己的物质武器，同样，无产阶级把哲学当作自己的精神武器”，这个论断的含义是(   )。,9775964,B
9782176,“ 责人之心责己爱己之心爱人”体现(   )原则。<br />,9775982,B
9781393,信念是(  )的有机统一体为人们矢志不渝、百折不挠地追求理想目标提供了强大的精神动力<br />,9776064,A
9775411,社会主义按劳分配的原则(   )。,9776121,A;B;D
9780758,1928年12月29日，张学良在东北发出通告，宣布 ( ) ，这样，国民党就在全国范围内建立了自己的统治。,9780627,B
9780792,五四前后，为了扩大马克思主义的思想阵地，共产党早期组织的成员同以 ( ) 为代表的反马克思主义的思想流派进行了斗争,9780706,B;C;D
9780706,《天朝田亩制度》反映了太平天国领导者想建立的理想社会的特征是 ( ) ,9780741,A;B;C;D
9780741,国民党政府实行一党专政的军事独裁的措施 ( ) ,9780758,B;C;D
9776121,20世纪30年代，在发动全面侵华战争以前，日本帝国主义制造的局部侵华事件有 ( ) ,9780770,A;B;D
9781704,在社会主义建设过程中，毛泽东提出要造成一个(   )的政治局面的思想。,9780792,A;B;C;D
9781479,道德往往借助于(   )等形式来使认识功能发挥作用。<br />,9780922,D
9775358,货币的本质通过它的职能体现出来，货币有多种职能，其中最基本的职能是(   )。,9780928,D
9780770,社会主义三大改造是指 ( ) ,9780994,B
9775284,社会改革与社会革命的区别在于(   )。,9781035,A
9781472,中国古人的下列说法中对今天我们进行道德修养、锤炼个人品德仍具有很好借鉴作用的有(   )。<br />,9781072,C
9768367,中国政府始终本着（）、（）、（）的态度向国内外发布新冠肺炎疫情信息，积极回应各方关切，加强与国际社会合作。,9781181,C
