9775589,下列观点中，不属于新文化运动倡导者的观点的是 ( ) ,9775172,A
9775836,人们在实践中形成的、有实现可能性的、对未来社会和自我发展目标的向往与追求是人们的世界观、人生观和价值观在奋斗目标上的集中体现指的是<br />,9775264,A;D;E
9780565,我国的政权组织形式是(   )。<br />,9775324,A;B;C;E
9780644,消费者有挑选经营者、选择购买的商品或接受的服务种类、数量、选择购买或不购买商品、接受或不接受服务的自由这体现了民法上的(   )。<br />,9775343,B;C;D
9780849,人们在公共生活中应该爱惜和保护全民和集体所有的公共财物。这是社会公德中的(   )。<br />,9775386,A;B;D
9781077,依法治国，要适应社会主义市场经济发展、社会全面进步的新形势，加强(   )，提高(   )，形成中国特色社会主义法律体系。,9775410,A;B;D
9768641,十三届全国人大三次会议2020年5月28日下午举行闭幕会，表决通过了《中华人民共和国民法典》，这部法律将自（）起施行。,9775589,D
9774823,“观念的东西不外是移入人脑并在人脑中改造过的物质的东西而已”，这是(   )。,9775818,B
9775903,建设社会主义法治国家明确了全面依法治国的性质和方向也突出了全面( )的工作重点。<br />,9775836,B
9775172,社会主义实现由空想到科学发展的标志是(   )。,9775848,B
9775936,由一定的规则维系的人们公共生活的一种有序化状态是(   )。<br />,9775903,A
9775264,阶级斗争在社会发展中的作用在于(   )。,9775936,B
9819529,小康社会的构建过程包括（）。,9776077,A
9775410,马克思主义经典作家站住科学的立场上，提出并自觉运用的预见未来社会的科学方法是(   )。,9776102,C
9768539,我们要致力于在（）和地区事务等领域加强同拉美地区合作，努力构建携手共进的中拉命运共同体。,9776103,D
9768409,在中国特色社会主义新时代，爱国就是坚定中国特色社会主义（），在前人接力探索的基础上，继续把中国特色社会主义事业推向前进，继续为实现中华民族伟大复兴的中国梦不懈奋斗。,9776113,D
9775386,垄断资本主义的发展为向社会主义过渡准备了物质条件，主要表现在(   )。,9780565,B
9819647,国家治理能力是运用国家制度管理社会各方面事务的能力，包括（）等各个方面。,9780569,C
9780722,五四前后，为了扩大马克思主义的思想阵地，共产党早期组织的成员同以 ( ) 为代表的反马克思主义的思想流派进行了斗争,9780631,D
9775324,社会的物质性主要表现在(   )。,9780644,B
9781801,建设民主政治必须把广大人民群众的积极性和主动性充分调动起来，坚持(   )，民族区域自治，进一步扩大基层民主。,9780698,A;B;C;D
9775343,形而上学否定观的主要错误在于(   )。,9780722,A;B;C;D
9819786,媒体融合包括内容融合和（）等方面。,9780818,B
9768601,开放型经济发展带来的巨大收益有（）。 ,9780849,A
9781394,下列关于理想与现实的关系的说法中正确的有<br />,9780981,C
9780698,过渡时期总路线提出具备的实现的可能性有 ( ) ,9781030,C
9768163,朱德在《七律•长征》一诗中，用\,9781077,D
9763938,坚持“九二共识”、反对“台独”是两岸关系和平发展的政治基础，其核心是认同大陆和台湾同属一个中国。,9781118,D
9767063,物质是永恒的。,9781193,A
9766800,在新的历史条件下，科学把握社会主要矛盾变化，对全面推动新时代党和国家事业发展、实现中华民族伟大复兴，具有重大的现实意义。,9781214,C
9767405,集体主义是对个人的压制、是对个性的束缚。,9781394,A;D
9767247,外国青少年在中国不需要遵守中国的法律。,9781580,B
9767638,资产阶级提出的“民主、自由、博爱”同社会主义核心价值观一样具有道义性、真实性。,9781801,B;C;D
9765918,三民主义学说是一个比较完整而明确的资产阶级民主革命纲领。,9781861,B
9819862,2020年1月25日，中共中央政治局常务委员会召开会议，习近平总书记指出，面对新型冠状病毒感染的肺炎疫情加快蔓延的严重形势，必须加强党中央集中统一领导。,9781868,D
9766016,戊戌维新运动的目标是在中国建立美国式的民主共和制的资本主义制度。,9781926,B
9765455,1949年(&nbsp;)成立，标志着新民主主义革命阶段的基本结束和社会主义革命阶段的开始。,9781935,C
9764907,历史反复证明，(&nbsp;)是历史发展和社会进步的主体力量。,9781943,C
9767197,我国社会主义法律既具有鲜明的阶级性，又具有广泛的人民性，体现了(&nbsp;)与人民性的统一。,9782110,C
9764675,1956年底，我国对(&nbsp;)、(&nbsp;)和(&nbsp;)的社会主义改造基本完成。,9782157,D
9767953,理想具有(&nbsp;)，不仅体现为它受时代条件的制约，而且体现为它随着时代的发展而发展。,9782199,C
9764029,实现伟大梦想，必须进行伟大斗争，必须建设(&nbsp;)，必须推进(&nbsp;)。,9819529,A;B;C;D
9766505,资本主义的发展经历了两个阶段：自由竞争资本主义和(&nbsp;)。,9819647,A;B;C;D
9766635,(&nbsp;)是指商品能满足人的某种需要的有用性，反映的是人与自然之间的物质关系，是商品的自然属性，是一切劳动产品所共有的属性离开了商品它就不复存在。,9819786,A;B;C;D
9763646,文化的(&nbsp;)性是人类文明进步的重要动力。,9819805,D
9763731,(&nbsp;)是现代战争的核心战斗力。,9819862,true
9774967,衡量社会进步的根本标准是(   )。,9763593,false
9775126,“通过批判旧世界来发现新世界”是(   )。,9763605,false
9775565,国民党成立于 ( ) 年,9763724,\u4E60\u8FD1\u5E73
9819759,以下属于媒体融合发展方式中的“品牌新媒体”带动型的是（）。,9763743,false
9780823,新时期爱国主义的基本特征是坚持爱国主义与(   )。<br />,9763910,\u53C2\u653F\u515A
9781204,发展开放型经济，必须大力发展(   )。,9764030,\u793E\u4F1A\u4E3B\u4E49\u73B0\u4EE3\u5316
9774909,感觉、知觉、表象是(   )。,9765018,\u4F1F\u5927\u6597\u4E89
9781625,自我修养必须落实到行动上只有身体力行对自己严格要求把正确的认识转化为现实的行为变成习惯才能真正达到自我修养的较高境界。这说明自我修养中最重要的环节是(  )<br />,9765157,\u9093\u5C0F\u5E73
9819830,如何进行口罩气密性检查，下列描述正确说法的是（）。,9765273,true
9780644,消费者有挑选经营者、选择购买的商品或接受的服务种类、数量、选择购买或不购买商品、接受或不接受服务的自由这体现了民法上的(   )。<br />,9765489,\u7EDF\u4E00\u6218\u7EBF;\u6B66\u88C5\u6597\u4E89;\u515A\u7684\u5EFA\u8BBE
9775860,爱国主义的基础是<br />,9765693,\u9648\u72EC\u79C0
9781857,四书五经中(   )开宗明义的道出了大学的理念。即:大学之道在明明德在新民在止于至善。《大学》 《论语》 《诗经》 《尚书》<br />,9765859,\u82CF\u8054
9774876,马克思主义普遍真理与中国具体实际相结合这一基本原则的最重要的理论基础是(   )。,9766121,\u798F\u5DDE;\u5B81\u6CE2;\u4E0A\u6D77
9780880,社会经济关系的性质决定着各种道德体系的。<br />,9766538,true
9780655,爱国主义要求爱人民群众对人民群众感情的深浅程度是检验一个人对祖国忠诚程度的(   )。<br />,9766639,\u5974\u96B6\u793E\u4F1A
9780639,下列选项中属于科学信念的是(   )。<br />,9767978,false
9782053,在人的生命历程中理想和信念是如影随形相互依存表现在(   )。<br />,9768472,A;B;C
9775587,新中国发展国民经济的第一个五年计划期间是指 ( ) ,9768482,A;B;C
9775208,阶级斗争对阶级社会发展的推动作用突出表现在(   )。,9768610,A;B;C
9781622,即使在个人单处无人监督时也坚守自己的道德信念对自己的言行小心谨慎不做不道德的事。这种道德修养的方法是:<br />,9768620,true
9774999,在马克思主义的组成部分中，构成整个马克思主义思想体系的核心的是(   )。,9774838,B
9780586,根据我国宪法的规定由于国家机关和国家工作人员侵犯公民权利而受到损害的公民有依照法律规定取得(   )的权利。<br />,9774876,D
9781277,摸着石头过河和(   )是辩证统一的。,9774909,A
9780629,任何信仰都包含着两个基本方面它们是(   )。<br />,9774967,C
9781066,党的一切工作，必须以最广大人民的根本利益为最高标准。任何时候都必须坚持尊重社会发展规律与尊重(   )的一致性。,9774999,C
9780937,党在领导新民主主义革命的过程中，把(   )作为一项“伟大的工程”。,9775126,B
9774838,事物发展的动力是(   )。,9775132,A
9780978,三大改造的实质是(   )。,9775203,C
9775988,社会主义道德是(   )伦理思想同中国特色社会主义伟大实践相结合的产物是对中国古代优良道德传统的传承与升华是中国革命道德传统的直接继承和发展。<br />,9775208,C
9775132,作为中国共产党和社会主义事业指导思想的马克思主义是指(   )。,9775236,C;D
9775203,十一届三中全会以来，我党制定的一系列正确的路线、方针、政策促进了我国经济的迅猛发展，这说明(   )。,9775308,B;C;D
9782011,《宪法》规定“保卫祖国、抵抗侵略是中华人民共和国每一个公民的(   )”。<br />,9775381,A;B;C;D;E
9775574,造成近代中国贫穷落后的根本原因是  ( ) ,9775565,A
9819878,宪法规定，国家建立健全同经济发展水平（）的社会保障制度。,9775574,B
9775882,人们在处理个人与他人个人与社会关系的一系列行为中表现出来的比较稳定的道德倾向和特征称为<br />,9775587,D
9781030,社会主义建设时期，提出要建立“适合于我国情况和人民需要的社会主义市场”的思想的党和国家领导人是(   )。,9775860,A
9781231,社会保障体系发挥兜底作用，保障全社会成员(   )。,9775875,C
9780812,贯穿中国历史发展的一条主线是(   )。<br />,9775882,C
9781181,(   )是永续发展的必要条件。,9775988,B
9775875,(  )是近代以来中华民族最伟大的梦想。<br />,9776154,B;C
9768610,在创新发展理念下，中国正在把握新一轮科技革命和产业革命带来的机遇，并利用新技术创造经济发展的新动能，继续培育（）、（）、（），极大地激发了社会创造力和市场活力,9780586,D
9781451,社会主义核心价值体系包括(   )。<br />,9780629,C
9768472,民生问题是影响实现全面建成小康社会目标的突出因素，解决这些问题，需要按照（）、（）、（）的要求，持续加大保障和改善民生力度，不断提高人民生活水平，实现全体人民共同迈入全面小康社会。,9780639,C
9776154,1905至1907年间，革命派与改良派展开了大论战，其主要舆论阵地是 ( ) ,9780644,B
9780671,在1931年1月至1935年1月期间出现的王明\,9780655,A
9781420,2012年9月10日日本政府宣布“购买”钓鱼岛及其附属岛屿。此后几天我国不少地方的群众尤其是青年人自发走上街头、抗议日本政府非法“购岛”行径表达了中国人民的正义立场和爱国精神形成了维护主权捍卫领土的强大声势。爱祖国的大好河山是爱国主义的基本要求之一。这是因为<br />,9780671,A;B;C;D
9775381,垄断竞争的特点(   )。,9780737,A;B;C
9781729,我国对资本主义工商业实行赎买政策中的“四马分肥”是指(   ),9780812,C
9781535,在中国传统道德中反映重视道德践履强调修养的重要性倡导道德主体要在完善自身中发挥自己的能动作用的是(   )。<br />,9780823,A
9768482,习近平总书记对提出对各类困难群众要做到的“三个格外”是（）。,9780880,B
9775308,下列各项正确反映因果联系的有(   )。,9780937,C
9775236,马克思恩格斯最重要的理论贡献是(   )。,9780978,C
9781422,2014年6月10日国务院新闻办公室发表《“一国两制”在香港特别行政区的实践》白皮书强调对治港主体的基本政治要求是必须爱国。爱国主义是中华民族精神的核心在经济全球化的条件下国家仍然是民族存在的最高组织形式是国际社会活动的独立主体只要国家继续存在爱国主义就有坚实的基础和丰富的意义。在当今中国必须认识到<br />,9781030,C
9781423,置身于实现中华民族伟大复兴的时代洪流之中应当以时代使命为己任把握时代脉搏迎接时代挑战增强创新创造的能力和本领勇做改革创新的实践者将弘扬改革创新精神贯穿于实践中体现在行动上。具体说来应该<br />,9781066,A
9780737,洋务运动时期，清政府创办的新式学堂有： ( ) ,9781181,C
9763743,中国共产党领导的多党合作制度就是多党制。,9781204,A
9766538,当遇到经济危机时，资本主义国家政府也会出面干预经济。,9781231,A
9819797,人民日报全媒体平台，也就是“中央厨房”项目的建设，自2014年10月份正式立项，2017年建成。,9781277,A
9763593,中国共产党的领导地位是与生俱来的、一劳永逸的。,9781420,A;B;D
9763605,党的全国代表大会每六年举办一次。,9781422,A;B;C;D
9819875,喝高度白酒可以有效杀灭新冠状病毒。,9781423,A;B;C
9819652,十九届四中全会提出，坚持和完善独立自主的和平外交政策，推动构建中华民族共同体。,9781451,A;C
9767978,理想是人们在想象的基础上对社会历史发展规律的正确把握。,9781535,A;B;C;D
9768620,设施联通是合作发展的基础。,9781622,C
9765273,中共八大的路线是正确的，它为社会主义事业的发展和党的建设指明了方向。,9781625,B
9765859,二战后，(&nbsp;)经过战争考验，成为可以与美国抗衡的世界一流强国。,9781729,A;B;C;D
9765489,中国共产党在中国革命中战胜敌人的三个法宝是(&nbsp;)、(&nbsp;)、(&nbsp;)。,9781857,A
9765018,党的十九大强调，实现伟大梦想，必须进行(&nbsp;)。,9782011,A
9765693,八七会议彻底清算了大革命后期(&nbsp;)的右倾机会主义错误。,9782053,C
9763724,进入新时代，我们党以(&nbsp;)强军思想为指引，坚持走中国特色强军之路。,9819652,false
9763910,在我国社会主义政治制度中，民主党派是(&nbsp;)。,9819759,C
9766121,1842年《南京条约》规定，开放广州、厦门、(&nbsp;)、(&nbsp;)、(&nbsp;)等5个港口城市为通商口岸。,9819797,true
9765157,在全党的要求下，1977年7月召开的中共十届三中全会决定恢复(&nbsp;)在1976年被撤销的一切职务。,9819830,D
9766639,(&nbsp;)是人类历史上第一个阶级剥削社会。,9819875,false
9764030,全面建设社会主义现代化国家的进程分两个阶段来安排。第一个阶段，从2020年到2035年，在全面建成小康社会的基础上，再奋斗15年，基本实现(&nbsp;)。,9819878,C
9774872,我国独立自主、自力更生相对外开放方针的主要理论基础是(   )。,9763910,\u53C2\u653F\u515A
9775069,经济全球化发展趋势的现实基础是(   )。,9764573,\u5206\u6E05\u654C\u6211;\u5206\u6E05\u662F\u975E
9775936,由一定的规则维系的人们公共生活的一种有序化状态是(   )。<br />,9764907,\u4EBA\u6C11\u7FA4\u4F17
9781845,马克思指出:“真正的爱情是表现在恋人对他的偶像采取含蓄、谦恭甚至羞涩的态度而绝不是表现在随意流露热情和过早的亲昵。”他的意思是说在恋爱过程中双方应该(   )。<br />,9764908,\u6BDB\u6CFD\u4E1C
9781230,履行好政府(   )调节职能，加快推进基本公共服务均等化，缩小收入分配差距。,9765135,false
9780853,众人相帮;一方有难八方支援。这是中华民族的传统美德也是我们社会中人与人之间的交往应遵循的(   )。<br />,9765788,false
9775119,当前，为实现共产主义理想而奋斗，集中体现在(   )。,9766006,\u5929\u4EAC\u4E8B\u53D8
9781186,坚持开放发展，就要努力提髙我国在全球经济治理中的(   )，构建广泛的利益共同体。,9766903,\u7406\u8BBA\u8054\u7CFB\u5B9E\u9645;\u5B9E\u4E8B\u6C42\u662F
9775647,1949年4月，宣告国民党在大陆22年统治覆灭的重大历史事件是人民解放军解放 ( ) ,9767050,\u5BA2\u89C2\u5B58\u5728
9781159,(   )是党领导的事业不断取得胜利的重要法宝。,9767391,false
9775901,商法是调整( )主体之间商事关系的法律规范。<br />,9767404,false
9781163,(   )是人类文明进步的基础。,9767609,\u6838\u5FC3\u4EF7\u503C\u89C2
9775928,检验一个人对祖国忠诚程度的试金石是<br />,9767621,\u4EBA\u6C11\u6027
9775514,\,9767808,true
9775532,近代中国的社会性质是 ( ) ,9767953,\u65F6\u4EE3\u6027
9781196,建设现代化经济体系，必须建设统一开放、竞争有序的(   )。,9767973,false
9819878,宪法规定，国家建立健全同经济发展水平（）的社会保障制度。,9768138,false
9782184,下列属于夫妻共同财产的是(   )。<br />,9768153,true
9780555,国务院有权根据宪法和法律制定(   )。<br />,9768314,true
9781055,“和平统一、一国两制”的核心是(   )。,9768365,A
9819678,建设粤港澳大湾区，既是新时代推动形成全面开放新格局的新尝试，也是推动“一国两制”事业发展的（）。,9768451,B
9775756,中共一大召开的时间是 ( ) ,9768556,true
9781227,抓民生要抓住人民最关心最直接最现实的(   )问题，抓住最需要关心的人群，锲而不舍解决好、保障好、改善好。,9774872,B
9819619,社会主义民主的本质是人民当家作主。对“人民当家作主”理解正确的是（）。,9775069,C
9775191,经济政治发展的不平衡是资本主义的绝对规律，由此得出结论：社会主义可能首先在少数或者甚至在单独一个资本主义国家内获得胜利。提出这一著名论断的是(   )。,9775119,A
9780920,毛泽东规定了(   )的军事原则。,9775191,C
9819669,以（）为内涵的新发展理念，是我国经济由高速增长阶段转向高质量发展阶段的重要指导理念。,9775265,A;B;C;D
9768365,（）的理念为新冠肺炎疫情防控夯实了深厚的群众基础。,9775306,A;D
9768451,教育是解决贫困为题的治本之策。我们要继续加大对（）的投入力度，加快学前教育、义务教育学校标准化和完善寄宿制学校建设步伐。,9775346,A;C;E
9776066,国共重庆谈判的焦点是 ( ) ,9775514,C
9781928,“一个人做了这样或那样一件合乎伦理的事还不能说他是有德的;只有当这种行为方式成为他性格中的固定要素时他才可以说是有德的。”这表明道德品质是(   )。<br />,9775532,A
9781590,对于个人理想的性质、内容以及实现有着决定性影响的是<br />,9775647,D
9781934,个人在道德意识、道德行为方面自觉地按照一定社会或阶级的道德要求所进行的自我审度、自我教育、自我锻炼、自我改造和自我完善的活动被称为(   )。<br />,9775756,C
9775933,邓小平曾告诫我们:谈到人格但不要忘记还有一个国格。这里的国格说明一个真正的爱国者要<br />,9775856,D
9775891,道德模范()<br />,9775891,B
9782120,“天行健君子以自强不息”体现了中华民族的(   )。<br />,9775901,A
9775856,时代精神的核心是<br />,9775928,A
9819524,党的十九大提出：从2035年到本世纪中叶，在基本实现现代化的基础上，再奋斗15年，把我国建成（）的社会主义现代化强国。,9775933,C
9781604,爱国主义的基础是<br />,9775936,B
9781152,科学发展观强调，(   )是加快转变经济发展方式的关键。,9776066,A
9819534,创新发展，包括（）。,9780555,C
9780668,中国革命取得胜利的法宝是 ( ) ,9780668,B;C;D
9775346,下列各项属于世界统一性问题的有(   )。,9780782,A;B;C;D
9775306,实践标准并不排斥逻辑证明在检验真理过程中的作用这是因为(   )。,9780792,A;B;C;D
9781813,以下属于社会主义核心价值观内容的有(   )。,9780853,C
9775265,社会改革的社会作用主要表现(   )。,9780920,D
9781525,以“八荣八耻”为主要内容的社会主义荣辱观(   )。<br />,9781055,B
9781529,大学生应在几个重要的环节上加强公民道德建设的实践(   )。<br />,9781152,D
9780782,1939年1月，国民党五届五中全会决定成立“防共委员会”，确定了 ( ) 方针。,9781159,A
9781443,大学生活的特点与中学相比发生了明显的变化主要表现在(   )。<br />,9781163,D
9819777,要从维护国家（）的高度，加强网络内容建设，使全媒体传播在法治轨道上运行。,9781186,B
9781407,要把公正公平公开原则贯穿立法全过程完善立法体制机制增强法律法规的<br />,9781196,B
9780792,五四前后，为了扩大马克思主义的思想阵地，共产党早期组织的成员同以 ( ) 为代表的反马克思主义的思想流派进行了斗争,9781227,C
9781462,人生目的的作用有(   )。<br />,9781230,B
9781471,道德逐渐从风俗习惯中分化出来成为一种相对独立的社会意识形式是因为(   )。<br />,9781407,A;B;C;D
9768556,发挥制度优势，必须紧紧依靠人民群众、发动人民群众。,9781443,A;B;C
9768153,个人主义主张个人本身就是目的，具有最高价值，社会和他人只是达到个人目的的手段。,9781462,A;B;C;D
9767973,“立志做大事”就是要做大的、不平凡的事，因此从事平凡的工作是胸无大志的表现。,9781471,A;C;D
9765135,社会主义初级阶段是任何国家进入社会主义社会时都必须经历的阶段。,9781525,A;B;C;D
9767404,为人民服务是党的宗旨，所以只适于党员干部。,9781529,A;B;C
9768138,法律调整社会关系的范围和方式更加广泛灵活，可以弥补思想道德调整的短板，与思想道德一道共同促进良好社会秩序的形成。,9781590,D
9767808,创新始终是推动人类社会发展的第一动力。,9781604,A
9765788,孙中山的三民主义是第一次国共合作的政治基础。,9781813,A;B;C;D
9767391,道德具有阶级性，并无普遍性。,9781845,C
9768314,牢固树立人才是战略资源理念，是通过制度建设培养和集聚更多优秀人才的前提。,9781928,B
9766903,中国共产党在领导人民进行革命、建设、改革的长期实践中，逐步形成和确立了一条正确的思想路线，其基本内涵是一切从实际出发、(&nbsp;)、(&nbsp;)，在实践中检验和发展真理。,9781934,B
9766006,(&nbsp;)成为太平天国由盛转衰的分水岭。,9782120,C
9767609,(&nbsp;)是文化软实力的灵魂、文化软实力建设的重点。,9782184,D
9764908,(&nbsp;)是马克思主义中国化的伟大开拓者，是毛泽东思想的主要创立者。,9819524,D
9763910,在我国社会主义政治制度中，民主党派是(&nbsp;)。,9819534,A;B;C;D
9764573,敌我之间和人民内部这两类矛盾的性质不同，解决的方法也不同。简单地说起来，前者是(&nbsp;)的问题，后者是(&nbsp;)的问题。,9819619,B
9767621,社会主义核心价值观的(&nbsp;)体现在它所代表的最广大人民的根本利益，反映的最广大人民的价值诉求，引导着最广大人民为实现美好社会理想而奋斗。,9819669,C
9767050,所谓物质，就是不依赖于人类的意识而存在，并能为人类的意识所反映的(&nbsp;)。,9819678,B
9764907,历史反复证明，(&nbsp;)是历史发展和社会进步的主体力量。,9819777,A;B;C
9767953,理想具有(&nbsp;)，不仅体现为它受时代条件的制约，而且体现为它随着时代的发展而发展。,9819878,C
9781287,(   )是社会主义法治最根本的保证。,9764024,\u4E2D\u56FD\u529B\u91CF
9782074,确立理想信念最集中和突出的时期是(   )。<br />,9764126,true
9780949,中国革命最基本的动力是(   )。,9764225,true
9781289,新时代党的建设总要求是坚持和加强党的全面领导，坚持党要管党、全面从严治党，以(   )为主线。,9764564,\u300A\u8BBA\u5341\u5927\u5173\u7CFB\u300B
9768514,我国独立自主的和平外交政策，应坚持把（）放在首位。,9764768,\u519C\u6C11
9782058,共产主义是一种理想、一种制度、一种学说更是(   )。<br />,9764803,true
9780562,全国人民代表大会是由(   )。<br />,9764923,true
9775069,经济全球化发展趋势的现实基础是(   )。,9765156,\u79D1\u5B66\u53D1\u5C55\u89C2
9780824,全国人民代表大会及其常委会制定的规范性法律文件叫(   )。<br />,9765591,\u5E73\u578B\u5173\u5927\u6377
9781930,在人类历史上原始社会的经济关系产生了原始共产主义道德封建社会的经济关系产生了封建主义道德资本主义社会的经济关系产生了资本主义道德社会主义社会的经济关系产生了社会主义道德。这说明(   )。<br />,9765615,true
9775822,解放战争期间，台湾人民反抗国民党暴政的重要活动是 ( ) ,9765766,\u5927\u9769\u547D
9782196,中国革命道德传统是指(     )以后中国共产党人、一切先进分子和人民群众在中国新民主主义革命和社会主义革命、建设和改革中形成的革命气概、精神品质和道德情操。<br />,9765904,\u6B66\u660C
